{
    "type": "object",
    "title": "GII Country schema",
    "$schema": "http://json-schema.org/draft-04/schema",
    "required": ["country"],
    "properties": {
        "labour_force_participation_rate_aged_15_and_above_male_2012": {
            "type": ["string","null"],
            "_db_settings": {
                "type": "float"
                }
        },
        "hdi_rank": {
            "type": ["string","null"],
            "_db_settings": {
                "type": "integer"
            }
        },
        "gender_inequality_index_value_2013": {
            "type": ["string","null"],
            "_db_settings": {
                "type": "float"
            }
        },
        "gender_inequality_index_rank_2013": {
            "type": ["string","null"],
            "_db_settings": {
                "type": "float"
            }
        },
        "population_with_some_secondary_ed_aged_25_and_up_fem_2005_2012": {
            "type": ["string","null"],
            "_db_settings": {
                "type": "float"
            }
        },
        "country": {
            "type": ["string","null"],
            "_db_settings": {
                "type": "string",
                "primary_key": true
            }
        },
        "_2010_2015_adolescent_birth_rate_births_per_1_000_women_aged_15_19": {
            "type": ["string","null"],
            "_db_settings": {
                "type": "float"
            }
        },
        "labour_force_participation_rate_aged_15_and_above_female_2012": {
            "type": ["string","null"],
            "_db_settings": {
                "type": "float"
            }
        },
        "_2013_share_of_seats_in_parliament_held_by_women": {
            "type": ["string","null"],
            "_db_settings": {
                "type": "float"
            }
        },
        "population_with_some_secondary_ed_aged_25_and_up_male_2005_2012": {
            "type": ["string","null"],
            "_db_settings": {
                "type": "float"
            }
        },
        "_2010_maternal_mortality_ratio_deaths_per_100_000_live_births": {
            "type": ["integer","null"],
            "_db_settings": {
                "type": "integer"
            }
        }
    }
}